### ISSUE TITLE
Unexpected hangup receiving from 3+ cameras on FreeBSD

### ISSUE THREAD

**Issue by thirtythreeforty** [thirtythreeforty/neolink#112]
This is moderately interesting:

```
   84 0.178067259 192.168.2.100 → 192.168.2.130 BAICHUAN 86 <VersionInfo>, type 80
   85 0.178521298 192.168.2.130 → 192.168.2.100 TCP 66 9000 → 36093 [ACK] Seq=3657 Ack=2212 Win=31856 Len=0 TSval=18538762 TSecr=425299129
   86 0.181141295 192.168.2.130 → 192.168.2.100 BAICHUAN/XML 600 <VersionInfo>, type 80
   87 0.181986047 192.168.2.100 → 192.168.2.130 TCP 70 Need more header [TCP segment of a reassembled PDU]
   94 0.222112695 192.168.2.130 → 192.168.2.100 TCP 66 9000 → 36093 [ACK] Seq=4191 Ack=2216 Win=31856 Len=0 TSval=18538773 TSecr=425299133
   95 0.222178373 192.168.2.100 → 192.168.2.130 BAICHUAN/XML 247 <Preview> (video), type 3
   96 0.222832652 192.168.2.130 → 192.168.2.100 TCP 66 9000 → 36093 [ACK] Seq=4191 Ack=2397 Win=34752 Len=0 TSval=18538773 TSecr=425299173
   99 0.231929908 192.168.2.130 → 192.168.2.100 BAICHUAN/XML 228 <Preview> (video), type 3
  102 0.273912553 192.168.2.100 → 192.168.2.130 TCP 66 36093 → 9000 [ACK] Seq=2397 Ack=4353 Win=65728 Len=0 TSval=425299225 TSecr=18538775
  111 0.845645307 192.168.2.130 → 192.168.2.100 BAICHUAN/XML 301 <VideoInput> (IPC desc), type 78
  112 0.886253331 192.168.2.100 → 192.168.2.130 TCP 66 36093 → 9000 [ACK] Seq=2397 Ack=4588 Win=65728 Len=0 TSval=425299837 TSecr=18538928
  113 0.887138812 192.168.2.130 → 192.168.2.100 BAICHUAN/XML 405 <Serial> (ptz), type 79
  114 0.929581796 192.168.2.100 → 192.168.2.130 TCP 66 36093 → 9000 [ACK] Seq=2397 Ack=4927 Win=65728 Len=0 TSval=425299881 TSecr=18538939
 1516 5.233525966 192.168.2.100 → 192.168.2.130 TCP 66 36093 → 9000 [FIN, ACK] Seq=2397 Ack=4927 Win=65728 Len=0 TSval=425304184 TSecr=18538939
 1519 5.235407260 192.168.2.130 → 192.168.2.100 TCP 66 9000 → 36093 [FIN, ACK] Seq=4927 Ack=2398 Win=34752 Len=0 TSval=18540026 TSecr=425304184
 1520 5.235522069 192.168.2.100 → 192.168.2.130 TCP 66 36093 → 9000 [ACK] Seq=2398 Ack=4928 Win=65664 Len=0 TSval=425304186 TSecr=18540026
```

192.168.2.100 = neolink, 192.168.2.130 = one of three currently deployed B400s (direct connection from neolink host -> switch -> the camera for now, nothing complicated)

From that, it... kind of looks like we're getting the VersionInfo, receiving a couple more packets from the camera, then shutting down the connection. Then, we're surprised that the connection has been shutdown =p:

```
[2020-12-20T19:25:21Z ERROR neolink::bc_protocol::connection] Deserialization error: DeserializationError(IoError(Custom { kind: UnexpectedEof, error: "Read returned 0 bytes" }))
[2020-12-20T19:25:21Z ERROR neolink] Error streaming from camera camera3, will retry in 1s: Timeout
```

**[EDIT]**
Note that I'm running FreeBSD, so it could be some subtle difference in how networking works here. A pointer towards what neolink might be executing at the time that the shutdown happens might be a good enough lead for me to debug it.

_Originally posted by @kevans91 in https://github.com/thirtythreeforty/neolink/issues/111#issuecomment-748650079_

**Comment by kevans91** [comment]
I factory reset all three cameras and installed a fourth, haven't had any issues since then and I've even restructured it into technically one more failure mode into a structure more like:

```
       shinobi+neolink host
                |
                | vpn
                |
                |
       socat host (:9000, :9001, :9002, :9003)
                |
                |
    cam0 - PoE switch  - cam3
           |        |
          cam1    cam2
```

Where ports 9000 - 9003 correspond to cam[0-3]:9000 respectively.

I think we can chalk this up to firmware oddity and close it...

**Comment by ENT108** [comment]
I am experiencing the very same issue with Lumus under Raspbian.
